scripts/tune_results/tune_largeD_h200.json
[
  {
    "N": 65536,
    "K": 256,
    "D": 1024,
    "dtype": "fp16",
    "best": {
      "BLOCK_N": 128,
      "BLOCK_K": 128,
      "BLOCK_D": 64,
      "num_warps": 8,
      "num_stages": 4
    },
    "time_us": 71.7519998550415
  },
  {
    "N": 65536,
    "K": 4096,
    "D": 1024,
    "dtype": "fp16",
    "best": {
      "BLOCK_N": 128,
      "BLOCK_K": 128,
      "BLOCK_D": 64,
      "num_warps": 8,
      "num_stages": 4
    },
    "time_us": 942.908763885498
  },
  {
    "N": 65536,
    "K": 65536,
    "D": 1024,
    "dtype": "fp16",
    "best": {
      "BLOCK_N": 128,
      "BLOCK_K": 128,
      "BLOCK_D": 64,
      "num_warps": 8,
      "num_stages": 4
    },
    "time_us": 17195.89385986328
  },
  {
    "N": 65536,
    "K": 256,
    "D": 2048,
    "dtype": "fp16",
    "best": {
      "BLOCK_N": 128,
      "BLOCK_K": 128,
      "BLOCK_D": 64,
      "num_warps": 8,
      "num_stages": 4
    },
    "time_us": 151.95200443267822
  },
  {
    "N": 65536,
    "K": 4096,
    "D": 2048,
    "dtype": "fp16",
    "best": {
      "BLOCK_N": 64,
      "BLOCK_K": 128,
      "BLOCK_D": 128,
      "num_warps": 4,
      "num_stages": 4
    },
    "time_us": 2277.7599334716797
  },
  {
    "N": 65536,
    "K": 65536,
    "D": 2048,
    "dtype": "fp16",
    "best": {
      "BLOCK_N": 64,
      "BLOCK_K": 128,
      "BLOCK_D": 128,
      "num_warps": 4,
      "num_stages": 4
    },
    "time_us": 42270.953369140625
  },
  {
    "N": 65536,
    "K": 256,
    "D": 4096,
    "dtype": "fp16",
    "best": {
      "BLOCK_N": 128,
      "BLOCK_K": 128,
      "BLOCK_D": 64,
      "num_warps": 8,
      "num_stages": 4
    },
    "time_us": 290.4831886291504
  },
  {
    "N": 65536,
    "K": 4096,
    "D": 4096,
    "dtype": "fp16",
    "best": {
      "BLOCK_N": 128,
      "BLOCK_K": 128,
      "BLOCK_D": 64,
      "num_warps": 8,
      "num_stages": 4
    },
    "time_us": 4860.667037963867
  },
  {
    "N": 65536,
    "K": 65536,
    "D": 4096,
    "dtype": "fp16",
    "best": {
      "BLOCK_N": 128,
      "BLOCK_K": 128,
      "BLOCK_D": 64,
      "num_warps": 8,
      "num_stages": 4
    },
    "time_us": 90358.11157226562
  },
  {
    "N": 65536,
    "K": 256,
    "D": 1024,
    "dtype": "fp32",
    "best": {
      "BLOCK_N": 128,
      "BLOCK_K": 128,
      "BLOCK_D": 32,
      "num_warps": 8,
      "num_stages": 4
    },
    "time_us": 146.561598777771
  },
  {
    "N": 65536,
    "K": 4096,
    "D": 1024,
    "dtype": "fp32",
    "best": {
      "BLOCK_N": 64,
      "BLOCK_K": 128,
      "BLOCK_D": 64,
      "num_warps": 4,
      "num_stages": 4
    },
    "time_us": 2251.1184692382812
  },
  {
    "N": 65536,
    "K": 65536,
    "D": 1024,
    "dtype": "fp32",
    "best": {
      "BLOCK_N": 64,
      "BLOCK_K": 128,
      "BLOCK_D": 64,
      "num_warps": 4,
      "num_stages": 4
    },
    "time_us": 38440.655517578125
  },
  {
    "N": 65536,
    "K": 256,
    "D": 2048,
    "dtype": "fp32",
    "best": {
      "BLOCK_N": 128,
      "BLOCK_K": 128,
      "BLOCK_D": 32,
      "num_warps": 8,
      "num_stages": 4
    },
    "time_us": 280.8448076248169
  },
  {
    "N": 65536,
    "K": 4096,
    "D": 2048,
    "dtype": "fp32",
    "best": {
      "BLOCK_N": 128,
      "BLOCK_K": 128,
      "BLOCK_D": 32,
      "num_warps": 8,
      "num_stages": 4
    },
    "time_us": 4636.072158813477
  },
  {
    "N": 65536,
    "K": 65536,
    "D": 2048,
    "dtype": "fp32",
    "best": {
      "BLOCK_N": 128,
      "BLOCK_K": 128,
      "BLOCK_D": 32,
      "num_warps": 8,
      "num_stages": 4
    },
    "time_us": 80850.48217773438
  },
  {
    "N": 65536,
    "K": 256,
    "D": 4096,
    "dtype": "fp32",
    "best": {
      "BLOCK_N": 128,
      "BLOCK_K": 128,
      "BLOCK_D": 32,
      "num_warps": 8,
      "num_stages": 4
    },
    "time_us": 546.3888168334961
  },
  {
    "N": 65536,
    "K": 4096,
    "D": 4096,
    "dtype": "fp32",
    "best": {
      "BLOCK_N": 128,
      "BLOCK_K": 128,
      "BLOCK_D": 32,
      "num_warps": 8,
      "num_stages": 4
    },
    "time_us": 9349.832153320312
  },
  {
    "N": 65536,
    "K": 65536,
    "D": 4096,
    "dtype": "fp32",
    "best": {
      "BLOCK_N": 128,
      "BLOCK_K": 128,
      "BLOCK_D": 32,
      "num_warps": 8,
      "num_stages": 4
    },
    "time_us": 157529.3701171875
  },
  {
    "N": 1048576,
    "K": 256,
    "D": 1024,
    "dtype": "fp16",
    "best": {
      "BLOCK_N": 128,
      "BLOCK_K": 128,
      "BLOCK_D": 64,
      "num_warps": 8,
      "num_stages": 4
    },
    "time_us": 1060.2304458618164
  },
  {
    "N": 1048576,
    "K": 4096,
    "D": 1024,
    "dtype": "fp16",
    "best": {
      "BLOCK_N": 128,
      "BLOCK_K": 128,
      "BLOCK_D": 64,
      "num_warps": 8,
      "num_stages": 4
    },
    "time_us": 17150.613403320312
  },
  {
    "N": 1048576,
    "K": 65536,
    "D": 1024,
    "dtype": "fp16",
    "best": {
      "BLOCK_N": 128,
      "BLOCK_K": 128,
      "BLOCK_D": 64,
      "num_warps": 8,
      "num_stages": 4
    },
    "time_us": 277923.6572265625
  },
  {
    "N": 1048576,
    "K": 256,
    "D": 1024,
    "dtype": "fp32",
    "best": {
      "BLOCK_N": 128,
      "BLOCK_K": 128,
      "BLOCK_D": 32,
      "num_warps": 8,
      "num_stages": 4
    },
    "time_us": 2278.7776947021484
  },
  {
    "N": 1048576,
    "K": 4096,
    "D": 1024,
    "dtype": "fp32",
    "best": {
      "BLOCK_N": 64,
      "BLOCK_K": 128,
      "BLOCK_D": 64,
      "num_warps": 4,
      "num_stages": 4
    },
    "time_us": 38344.9462890625
  }
]