scripts/tune_results/tune_smallD_h200.json
[
  {
    "N": 65536,
    "K": 256,
    "D": 64,
    "dtype": "fp16",
    "best": {
      "BLOCK_N": 128,
      "BLOCK_K": 128,
      "num_warps": 4,
      "num_stages": 2
    },
    "time_us": 15.559999644756317
  },
  {
    "N": 65536,
    "K": 4096,
    "D": 64,
    "dtype": "fp16",
    "best": {
      "BLOCK_N": 64,
      "BLOCK_K": 128,
      "num_warps": 4,
      "num_stages": 4
    },
    "time_us": 135.41760444641113
  },
  {
    "N": 65536,
    "K": 65536,
    "D": 64,
    "dtype": "fp16",
    "best": {
      "BLOCK_N": 64,
      "BLOCK_K": 128,
      "num_warps": 4,
      "num_stages": 4
    },
    "time_us": 2045.230484008789
  },
  {
    "N": 65536,
    "K": 200000,
    "D": 64,
    "dtype": "fp16",
    "best": {
      "BLOCK_N": 128,
      "BLOCK_K": 64,
      "num_warps": 4,
      "num_stages": 4
    },
    "time_us": 6623.336029052734
  },
  {
    "N": 65536,
    "K": 256,
    "D": 128,
    "dtype": "fp16",
    "best": {
      "BLOCK_N": 128,
      "BLOCK_K": 64,
      "num_warps": 4,
      "num_stages": 1
    },
    "time_us": 17.720000445842743
  },
  {
    "N": 65536,
    "K": 4096,
    "D": 128,
    "dtype": "fp16",
    "best": {
      "BLOCK_N": 128,
      "BLOCK_K": 128,
      "num_warps": 4,
      "num_stages": 1
    },
    "time_us": 165.94719886779785
  },
  {
    "N": 65536,
    "K": 65536,
    "D": 128,
    "dtype": "fp16",
    "best": {
      "BLOCK_N": 128,
      "BLOCK_K": 128,
      "num_warps": 4,
      "num_stages": 1
    },
    "time_us": 2611.944007873535
  },
  {
    "N": 65536,
    "K": 200000,
    "D": 128,
    "dtype": "fp16",
    "best": {
      "BLOCK_N": 128,
      "BLOCK_K": 64,
      "num_warps": 4,
      "num_stages": 1
    },
    "time_us": 9161.914825439453
  },
  {
    "N": 65536,
    "K": 256,
    "D": 256,
    "dtype": "fp16",
    "best": {
      "BLOCK_N": 128,
      "BLOCK_K": 64,
      "num_warps": 4,
      "num_stages": 1
    },
    "time_us": 28.68640124797821
  },
  {
    "N": 65536,
    "K": 4096,
    "D": 256,
    "dtype": "fp16",
    "best": {
      "BLOCK_N": 128,
      "BLOCK_K": 64,
      "num_warps": 4,
      "num_stages": 1
    },
    "time_us": 303.26879024505615
  },
  {
    "N": 65536,
    "K": 65536,
    "D": 256,
    "dtype": "fp16",
    "best": {
      "BLOCK_N": 128,
      "BLOCK_K": 64,
      "num_warps": 8,
      "num_stages": 1
    },
    "time_us": 5360.968017578125
  },
  {
    "N": 65536,
    "K": 200000,
    "D": 256,
    "dtype": "fp16",
    "best": {
      "BLOCK_N": 128,
      "BLOCK_K": 64,
      "num_warps": 8,
      "num_stages": 1
    },
    "time_us": 16791.98455810547
  },
  {
    "N": 65536,
    "K": 256,
    "D": 512,
    "dtype": "fp16",
    "best": {
      "BLOCK_N": 128,
      "BLOCK_K": 64,
      "num_warps": 8,
      "num_stages": 1
    },
    "time_us": 62.25600242614746
  },
  {
    "N": 65536,
    "K": 4096,
    "D": 512,
    "dtype": "fp16",
    "best": {
      "BLOCK_N": 128,
      "BLOCK_K": 64,
      "num_warps": 8,
      "num_stages": 1
    },
    "time_us": 666.3616180419922
  },
  {
    "N": 65536,
    "K": 65536,
    "D": 512,
    "dtype": "fp16",
    "best": {
      "BLOCK_N": 128,
      "BLOCK_K": 64,
      "num_warps": 8,
      "num_stages": 1
    },
    "time_us": 12686.952209472656
  },
  {
    "N": 65536,
    "K": 200000,
    "D": 512,
    "dtype": "fp16",
    "best": {
      "BLOCK_N": 128,
      "BLOCK_K": 64,
      "num_warps": 8,
      "num_stages": 1
    },
    "time_us": 38676.87072753906
  },
  {
    "N": 65536,
    "K": 256,
    "D": 64,
    "dtype": "fp32",
    "best": {
      "BLOCK_N": 128,
      "BLOCK_K": 64,
      "num_warps": 4,
      "num_stages": 1
    },
    "time_us": 17.577600479125977
  },
  {
    "N": 65536,
    "K": 4096,
    "D": 64,
    "dtype": "fp32",
    "best": {
      "BLOCK_N": 128,
      "BLOCK_K": 128,
      "num_warps": 4,
      "num_stages": 1
    },
    "time_us": 166.96640253067017
  },
  {
    "N": 65536,
    "K": 65536,
    "D": 64,
    "dtype": "fp32",
    "best": {
      "BLOCK_N": 128,
      "BLOCK_K": 128,
      "num_warps": 4,
      "num_stages": 1
    },
    "time_us": 2550.432014465332
  },
  {
    "N": 65536,
    "K": 200000,
    "D": 64,
    "dtype": "fp32",
    "best": {
      "BLOCK_N": 128,
      "BLOCK_K": 64,
      "num_warps": 4,
      "num_stages": 1
    },
    "time_us": 8719.53125
  },
  {
    "N": 65536,
    "K": 256,
    "D": 128,
    "dtype": "fp32",
    "best": {
      "BLOCK_N": 128,
      "BLOCK_K": 64,
      "num_warps": 4,
      "num_stages": 1
    },
    "time_us": 28.681600093841553
  },
  {
    "N": 65536,
    "K": 4096,
    "D": 128,
    "dtype": "fp32",
    "best": {
      "BLOCK_N": 128,
      "BLOCK_K": 64,
      "num_warps": 4,
      "num_stages": 1
    },
    "time_us": 302.1728038787842
  },
  {
    "N": 65536,
    "K": 65536,
    "D": 128,
    "dtype": "fp32",
    "best": {
      "BLOCK_N": 128,
      "BLOCK_K": 64,
      "num_warps": 8,
      "num_stages": 1
    },
    "time_us": 5294.571304321289
  },
  {
    "N": 65536,
    "K": 200000,
    "D": 128,
    "dtype": "fp32",
    "best": {
      "BLOCK_N": 128,
      "BLOCK_K": 64,
      "num_warps": 4,
      "num_stages": 1
    },
    "time_us": 16010.156250000002
  },
  {
    "N": 65536,
    "K": 256,
    "D": 256,
    "dtype": "fp32",
    "best": {
      "BLOCK_N": 128,
      "BLOCK_K": 64,
      "num_warps": 8,
      "num_stages": 1
    },
    "time_us": 62.86560297012329
  },
  {
    "N": 65536,
    "K": 4096,
    "D": 256,
    "dtype": "fp32",
    "best": {
      "BLOCK_N": 128,
      "BLOCK_K": 64,
      "num_warps": 8,
      "num_stages": 1
    },
    "time_us": 670.8559989929199
  },
  {
    "N": 65536,
    "K": 65536,
    "D": 256,
    "dtype": "fp32",
    "best": {
      "BLOCK_N": 128,
      "BLOCK_K": 64,
      "num_warps": 8,
      "num_stages": 1
    },
    "time_us": 12633.270263671875
  },
  {
    "N": 65536,
    "K": 200000,
    "D": 256,
    "dtype": "fp32",
    "best": {
      "BLOCK_N": 128,
      "BLOCK_K": 64,
      "num_warps": 8,
      "num_stages": 1
    },
    "time_us": 38592.108154296875
  },
  {
    "N": 65536,
    "K": 256,
    "D": 512,
    "dtype": "fp32",
    "best": {
      "BLOCK_N": 64,
      "BLOCK_K": 32,
      "num_warps": 4,
      "num_stages": 1
    },
    "time_us": 165.7439947128296
  },
  {
    "N": 65536,
    "K": 4096,
    "D": 512,
    "dtype": "fp32",
    "best": {
      "BLOCK_N": 64,
      "BLOCK_K": 32,
      "num_warps": 4,
      "num_stages": 1
    },
    "time_us": 2027.462387084961
  },
  {
    "N": 65536,
    "K": 65536,
    "D": 512,
    "dtype": "fp32",
    "best": {
      "BLOCK_N": 64,
      "BLOCK_K": 32,
      "num_warps": 4,
      "num_stages": 1
    },
    "time_us": 46187.06359863281
  },
  {
    "N": 65536,
    "K": 200000,
    "D": 512,
    "dtype": "fp32",
    "best": {
      "BLOCK_N": 64,
      "BLOCK_K": 32,
      "num_warps": 4,
      "num_stages": 1
    },
    "time_us": 140484.60693359375
  },
  {
    "N": 1048576,
    "K": 256,
    "D": 64,
    "dtype": "fp16",
    "best": {
      "BLOCK_N": 128,
      "BLOCK_K": 64,
      "num_warps": 4,
      "num_stages": 1
    },
    "time_us": 148.38720560073853
  },
  {
    "N": 1048576,
    "K": 4096,
    "D": 64,
    "dtype": "fp16",
    "best": {
      "BLOCK_N": 64,
      "BLOCK_K": 128,
      "num_warps": 4,
      "num_stages": 2
    },
    "time_us": 1947.4863052368164
  },
  {
    "N": 1048576,
    "K": 65536,
    "D": 64,
    "dtype": "fp16",
    "best": {
      "BLOCK_N": 128,
      "BLOCK_K": 128,
      "num_warps": 8,
      "num_stages": 4
    },
    "time_us": 31611.407470703125
  },
  {
    "N": 1048576,
    "K": 200000,
    "D": 64,
    "dtype": "fp16",
    "best": {
      "BLOCK_N": 128,
      "BLOCK_K": 64,
      "num_warps": 4,
      "num_stages": 4
    },
    "time_us": 99951.9287109375
  },
  {
    "N": 1048576,
    "K": 256,
    "D": 128,
    "dtype": "fp16",
    "best": {
      "BLOCK_N": 128,
      "BLOCK_K": 64,
      "num_warps": 4,
      "num_stages": 1
    },
    "time_us": 198.51679801940918
  },
  {
    "N": 1048576,
    "K": 4096,
    "D": 128,
    "dtype": "fp16",
    "best": {
      "BLOCK_N": 128,
      "BLOCK_K": 128,
      "num_warps": 8,
      "num_stages": 2
    },
    "time_us": 2588.368034362793
  },
  {
    "N": 1048576,
    "K": 65536,
    "D": 128,
    "dtype": "fp16",
    "best": {
      "BLOCK_N": 128,
      "BLOCK_K": 128,
      "num_warps": 8,
      "num_stages": 2
    },
    "time_us": 44776.24816894531
  },
  {
    "N": 1048576,
    "K": 200000,
    "D": 128,
    "dtype": "fp16",
    "best": {
      "BLOCK_N": 128,
      "BLOCK_K": 64,
      "num_warps": 4,
      "num_stages": 1
    },
    "time_us": 144662.95166015625
  },
  {
    "N": 1048576,
    "K": 256,
    "D": 256,
    "dtype": "fp16",
    "best": {
      "BLOCK_N": 128,
      "BLOCK_K": 64,
      "num_warps": 8,
      "num_stages": 1
    },
    "time_us": 388.919997215271
  },
  {
    "N": 1048576,
    "K": 4096,
    "D": 256,
    "dtype": "fp16",
    "best": {
      "BLOCK_N": 128,
      "BLOCK_K": 64,
      "num_warps": 4,
      "num_stages": 1
    },
    "time_us": 5015.69938659668
  },
  {
    "N": 1048576,
    "K": 65536,
    "D": 256,
    "dtype": "fp16",
    "best": {
      "BLOCK_N": 128,
      "BLOCK_K": 64,
      "num_warps": 8,
      "num_stages": 1
    },
    "time_us": 87568.5791015625
  },
  {
    "N": 1048576,
    "K": 200000,
    "D": 256,
    "dtype": "fp16",
    "best": {
      "BLOCK_N": 128,
      "BLOCK_K": 64,
      "num_warps": 8,
      "num_stages": 1
    },
    "time_us": 266354.3701171875
  },
  {
    "N": 1048576,
    "K": 256,
    "D": 512,
    "dtype": "fp16",
    "best": {
      "BLOCK_N": 128,
      "BLOCK_K": 64,
      "num_warps": 8,
      "num_stages": 1
    },
    "time_us": 839.7199630737305
  },
  {
    "N": 1048576,
    "K": 4096,
    "D": 512,
    "dtype": "fp16",
    "best": {
      "BLOCK_N": 128,
      "BLOCK_K": 64,
      "num_warps": 8,
      "num_stages": 1
    },
    "time_us": 10598.955535888672
  },
  {
    "N": 1048576,
    "K": 65536,
    "D": 512,
    "dtype": "fp16",
    "best": {
      "BLOCK_N": 128,
      "BLOCK_K": 64,
      "num_warps": 8,
      "num_stages": 1
    },
    "time_us": 198314.90478515625
  },
  {
    "N": 1048576,
    "K": 200000,
    "D": 512,
    "dtype": "fp16",
    "best": {
      "BLOCK_N": 128,
      "BLOCK_K": 64,
      "num_warps": 8,
      "num_stages": 1
    },
    "time_us": 616189.55078125
  },
  {
    "N": 1048576,
    "K": 256,
    "D": 64,
    "dtype": "fp32",
    "best": {
      "BLOCK_N": 128,
      "BLOCK_K": 64,
      "num_warps": 4,
      "num_stages": 1
    },
    "time_us": 199.7056007385254
  },
  {
    "N": 1048576,
    "K": 4096,
    "D": 64,
    "dtype": "fp32",
    "best": {
      "BLOCK_N": 128,
      "BLOCK_K": 128,
      "num_warps": 4,
      "num_stages": 1
    },
    "time_us": 2560.6815338134766
  },
  {
    "N": 1048576,
    "K": 65536,
    "D": 64,
    "dtype": "fp32",
    "best": {
      "BLOCK_N": 128,
      "BLOCK_K": 128,
      "num_warps": 8,
      "num_stages": 2
    },
    "time_us": 41730.206298828125
  },
  {
    "N": 1048576,
    "K": 200000,
    "D": 64,
    "dtype": "fp32",
    "best": {
      "BLOCK_N": 128,
      "BLOCK_K": 64,
      "num_warps": 4,
      "num_stages": 1
    },
    "time_us": 135116.93115234375
  },
  {
    "N": 1048576,
    "K": 256,
    "D": 128,
    "dtype": "fp32",
    "best": {
      "BLOCK_N": 128,
      "BLOCK_K": 64,
      "num_warps": 4,
      "num_stages": 1
    },
    "time_us": 398.63200187683105
  },
  {
    "N": 1048576,
    "K": 4096,
    "D": 128,
    "dtype": "fp32",
    "best": {
      "BLOCK_N": 128,
      "BLOCK_K": 64,
      "num_warps": 4,
      "num_stages": 1
    },
    "time_us": 4726.055908203125
  },
  {
    "N": 1048576,
    "K": 65536,
    "D": 128,
    "dtype": "fp32",
    "best": {
      "BLOCK_N": 128,
      "BLOCK_K": 64,
      "num_warps": 8,
      "num_stages": 1
    },
    "time_us": 85913.81225585938
  },
  {
    "N": 1048576,
    "K": 200000,
    "D": 128,
    "dtype": "fp32",
    "best": {
      "BLOCK_N": 128,
      "BLOCK_K": 64,
      "num_warps": 8,
      "num_stages": 1
    },
    "time_us": 247631.5185546875
  },
  {
    "N": 1048576,
    "K": 256,
    "D": 256,
    "dtype": "fp32",
    "best": {
      "BLOCK_N": 128,
      "BLOCK_K": 64,
      "num_warps": 8,
      "num_stages": 1
    },
    "time_us": 848.0256080627441
  },
  {
    "N": 1048576,
    "K": 4096,
    "D": 256,
    "dtype": "fp32",
    "best": {
      "BLOCK_N": 128,
      "BLOCK_K": 64,
      "num_warps": 8,
      "num_stages": 1
    },
    "time_us": 10176.435089111328
  },
  {
    "N": 1048576,
    "K": 65536,
    "D": 256,
    "dtype": "fp32",
    "best": {
      "BLOCK_N": 128,
      "BLOCK_K": 64,
      "num_warps": 8,
      "num_stages": 1
    },
    "time_us": 198218.15185546875
  },
  {
    "N": 1048576,
    "K": 200000,
    "D": 256,
    "dtype": "fp32",
    "best": {
      "BLOCK_N": 128,
      "BLOCK_K": 64,
      "num_warps": 8,
      "num_stages": 1
    },
    "time_us": 615227.34375
  },
  {
    "N": 1048576,
    "K": 256,
    "D": 512,
    "dtype": "fp32",
    "best": {
      "BLOCK_N": 64,
      "BLOCK_K": 32,
      "num_warps": 4,
      "num_stages": 1
    },
    "time_us": 2404.7231674194336
  },
  {
    "N": 1048576,
    "K": 4096,
    "D": 512,
    "dtype": "fp32",
    "best": {
      "BLOCK_N": 64,
      "BLOCK_K": 32,
      "num_warps": 4,
      "num_stages": 1
    },
    "time_us": 31329.013061523438
  },
  {
    "N": 1048576,
    "K": 65536,
    "D": 512,
    "dtype": "fp32",
    "best": {
      "BLOCK_N": 64,
      "BLOCK_K": 32,
      "num_warps": 4,
      "num_stages": 1
    },
    "time_us": 720339.74609375
  },
  {
    "N": 1048576,
    "K": 200000,
    "D": 512,
    "dtype": "fp32",
    "best": {
      "BLOCK_N": 64,
      "BLOCK_K": 32,
      "num_warps": 4,
      "num_stages": 1
    },
    "time_us": 2197482.03125
  }
]